message;result
"Lilly's mind filled with visions of me, trapped under her, my cock buried in her soaked pussy. Or with me trapped in-between Lilly's absurd over filled boobs. My tiny body barely big enough to protrude from her cavernous cleavage. Lilly surged against the stone wall. The rough surface scratches her in painful delight. But before Lilly could get the release she needed, Janet rounded the corner. The moment her eyes locked on lilly a vicious, evil sadistic smile grew. Well, well, well. She starts, lording Lilly's discovery like a villain. The giant freak is a freak after all! She taunted, her words laced with venom. What's the matter you big SLUT? Been too long since you got a good dicking? Janet was moving to take out her phone, clearly about to photograph Lilly in her exposed state. God, I bet you don't even know what dick feels like do you? Janet tries to imagine a world in which Lilly is totally alone. Discarded and ostracized. Her face twists in sick delight at the idea I mean, who, would ever want to be crushed to death by a giant cow like you?! She spat out, trying to break Lilly mentally. Both women knew full well; whoever threw the first strike would definitely lose their job. Lilly looked on at her vile, cruel, shameless, and outwardly fearless colleague. The she realized she had a picture of me on her phone. She pulled her clothes up making herself presentable again. Walking towards Janet she invaded her space, driving her backwards as she kept advancing. You think I'm so fucking hopeless don't you, Janet lilly growled through raging spite. But for your information I have a new boyfriend. She announced proudly fishing out her phone and bringing up the selfie I took in the mirror. My cute, tiny body, clad in just my boxers, on full display. Janet stared at the screen, at first taken totally by surprise. Then she started to realise; I was tiny. About the size of a small child. Janet's lips curled into a wicked grinLilly's mind filled with visions of me, trapped under her, my cock buried in her soaked pussy. Or with me trapped in-between Lilly's absurd over filled boobs. My tiny body barely big enough to protrude from her cavernous cleavage. Lilly surged against the stone wall. The rough surface scratches her in painful delight. But before Lilly could get the release she needed, Janet rounded the corner. The moment her eyes locked on lilly a vicious, evil sadistic smile grew. Well, well, well. She starts, lording Lilly's discovery like a villain. The giant freak is a freak after all! She taunted, her words laced with venom. What's the matter you big SLUT? Been too long since you got a good dicking? Janet was moving to take out her phone, clearly about to photograph Lilly in her exposed state. God, I bet you don't even know what dick feels like do you? Janet tries to imagine a world in which Lilly is totally alone. Discarded and ostracized. Her face twists in sick delight at the idea I mean, who, would ever want to be crushed to death by a giant cow like you?! She spat out, trying to break Lilly mentally. Both women knew full well; whoever threw the first strike would definitely lose their job. Lilly looked on at her vile, cruel, shameless, and outwardly fearless colleague. The she realized she had a picture of me on her phone. She pulled her clothes up making herself presentable again. Walking towards Janet she invaded her space, driving her backwards as she kept advancing. You think I'm so fucking hopeless don't you, Janet lilly growled through raging spite. But for your information I have a new boyfriend. She announced proudly fishing out her phone and bringing up the selfie I took in the mirror. My cute, tiny body, clad in just my boxers, on full displayLilly's mind filled with visions of me, trapped under her, my cock buried in her soaked pussy. Or with me trapped in-between Lilly's absurd over filled boobs. My tiny body barely big enough to protrude from her cavernous cleavage. Lilly surged against the stone wall. The rough surface scratches her in painful delight. But before Lilly could get the release she needed, Janet rounded the corner. The moment her eyes locked on lilly a vicious, evil sadistic smile grew. Well, well, well. She starts, lording Lilly's discovery like a villain. The giant freak is a freak after all! She taunted, her words laced with venom. What's the matter you big SLUT? Been too long since you got a good dicking? Janet was moving to take out her phone, clearly about to photograph Lilly in her exposed state. God, I bet you don't even know what dick feels like do you? Janet tries to imagine a world in which Lilly is totally alone. Discarded and ostracized. Her face twists in sick delight at the idea I mean, who, would ever want to be crushed to death by a giant cow like you?! She spat out, trying to break Lilly mentally. Both women knew full well; whoever threw the first strike would definitely lose Lilly's mind filled with visions of me, trapped under her, my cock buried in her soaked pussy. Or with me trapped in-between Lilly's absurd over filled boobs. My tiny body barely big enough to protrude from her cavernous cleavage. Lilly surged against the stone wall. The rough surface scratches her in painful delight. But before Lilly could get the release she needed, Janet rounded the corner. The moment her eyes locked on lilly a vicious, evil sadistic smile grew. ""Well, well, well."" She starts, lording Lilly's discovery like a villain. ""The giant freak is a freak after all!"" She taunted, her words laced with venom. ""What's the matter you big SLUT? Been too long since you got a good dicking?"" Janet was moving to take out her phone, clearly about to photograph Lilly in her exposed state. ""God, I bet you don't even know what dick feels like do you?"" Janet tries to imagine a world in which Lilly is totally alone. Discarded and ostracized. Her face twists in sick delight at the idea ""I mean, who, would ever want to be crushed to death by a giant cow like you?!"" She spat out, trying to break Lilly mentally. Both women knew full well; whoever threw the first strike would definitely lose their job. Lilly looked on at her vile, cruel, shameless, and outwardly fearless colleague. The she realized she had a picture of me on her phone. She pulled her clothes up making herself presentable again. Walking towards Janet she invaded her space, driving her backwards as she kept advancing. ""You think I'm so fucking hopeless don't you, Janet"" lilly growled through raging spite. ""But, for your information I have a new boyfriend."" She announced proudly fishing out her phone and bringing up the selfie I took in the mirror. My  body, clad in just my boxers, on full display. Janet stared at the screen, at first taken totally by surprise. Then she started to realise; I was tiny. About the size of a small dog. Janet's lips curled into a wicked grin ""holy fuck, cow! He's fucking tiny!"" She mocked viciously ""he must feel like a fucking mouse to you!"" She heaped on, vitriol oozing from her mouth. ""Can you even get him hard?"" Janet queried, not knowing when to quit.";?
"Lilly's mind filled with visions of me, trapped under her, my cock buried in her soaked pussy. Or with me trapped in-between Lilly's absurd over filled boobs. My tiny body barely big enough to protrude from her cavernous cleavage. Lilly surged against the stone wall. The rough surface scratches her in painful delight. But before Lilly could get the release she needed, Janet rounded the corner. The moment her eyes locked on lilly a vicious, evil sadistic smile grew. Well, well, well. She starts, lording Lilly's discovery like a villain. The giant freak is a freak after all! She taunted, her words laced with venom. What's the matter you big SLUT? Been too long since you got a good dicking? Janet was moving to take out her phone, clearly about to photograph Lilly in her exposed state. God, I bet you don't even know what dick feels like do you? Janet tries to imagine a world in which Lilly is totally alone. Discarded and ostracized. Her face twists in sick delight at the idea I mean, who, would ever want to be crushed to death by a giant cow like you?! She spat out, trying to break Lilly mentally. Both women knew full well; whoever threw the first strike would definitely lose their job. Lilly looked on at her vile, cruel, shameless, and outwardly fearless colleague. The she realized she had a picture of me on her phone. She pulled her clothes up making herself presentable again. Walking towards Janet she invaded her space, driving her backwards as she kept advancing. You think I'm so fucking hopeless don't you, Janet lilly growled through raging spite. But for your information I have a new boyfriend. She announced proudly fishing out her phone and bringing up the selfie I took in the mirror. My cute, tiny body, clad in just my boxers, on full display. Janet stared at the screen, at first taken totally by surprise. Then she started to realise; I was tiny. About the size of a small child. Janet's lips curled into a wicked grinLilly's mind filled with visions of me, trapped under her, my cock buried in her soaked pussy. Or with me trapped in-between Lilly's absurd over filled boobs. My tiny body barely big enough to protrude from her cavernous cleavage. Lilly surged against the stone wall. The rough surface scratches her in painful delight. But before Lilly could get the release she needed, Janet rounded the corner. The moment her eyes locked on lilly a vicious, evil sadistic smile grew. Well, well, well. She starts, lording Lilly's discovery like a villain. The giant freak is a freak after all! She taunted, her words laced with venom. What's the matter you big SLUT? Been too long since you got a good dicking? Janet was moving to take out her phone, clearly about to photograph Lilly in her exposed state. God, I bet you don't even know what dick feels like do you? Janet tries to imagine a world in which Lilly is totally alone. Discarded and ostracized. Her face twists in sick delight at the idea I mean, who, would ever want to be crushed to death by a giant cow like you?! She spat out, trying to break Lilly mentally. Both women knew full well; whoever threw the first strike would definitely lose their job. Lilly looked on at her vile, cruel, shameless, and outwardly fearless colleague. The she realized she had a picture of me on her phone. She pulled her clothes up making herself presentable again. Walking towards Janet she invaded her space, driving her backwards as she kept advancing. You think I'm so fucking hopeless don't you, Janet lilly growled through raging spite. But for your information I have a new boyfriend. She announced proudly fishing out her phone and bringing up the selfie I took in the mirror. My cute, tiny body, clad in just my boxers, on full displayLilly's mind filled with visions of me, trapped under her, my cock buried in her soaked pussy. Or with me trapped in-between Lilly's absurd over filled boobs. My tiny body barely big enough to protrude from her cavernous cleavage. Lilly surged against the stone wall. The rough surface scratches her in painful delight. But before Lilly could get the release she needed, Janet rounded the corner. The moment her eyes locked on lilly a vicious, evil sadistic smile grew. Well, well, well. She starts, lording Lilly's discovery like a villain. The giant freak is a freak after all! She taunted, her words laced with venom. What's the matter you big SLUT? Been too long since you got a good dicking? Janet was moving to take out her phone, clearly about to photograph Lilly in her exposed state. God, I bet you don't even know what dick feels like do you? Janet tries to imagine a world in which Lilly is totally alone. Discarded and ostracized. Her face twists in sick delight at the idea I mean, who, would ever want to be crushed to death by a giant cow like you?! She spat out, trying to break Lilly mentally. Both women knew full well; whoever threw the first strike would definitely lose Lilly's mind filled with visions of me, trapped under her, my cock buried in her soaked pussy. Or with me trapped in-between Lilly's absurd over filled boobs. My tiny body barely big enough to protrude from her cavernous cleavage. Lilly surged against the stone wall. The rough surface scratches her in painful delight. But before Lilly could get the release she needed, Janet rounded the corner. The moment her eyes locked on lilly a vicious, evil sadistic smile grew. ""Well, well, well."" She starts, lording Lilly's discovery like a villain. ""The giant freak is a freak after all!"" She taunted, her words laced with venom. ""What's the matter you big SLUT? Been too long since you got a good dicking?"" Janet was moving to take out her phone, clearly about to photograph Lilly in her exposed state. ""God, I bet you don't even know what dick feels like do you?"" Janet tries to imagine a world in which Lilly is totally alone. Discarded and ostracized. Her face twists in sick delight at the idea ""I mean, who, would ever want to be crushed to death by a giant cow like you?!"" She spat out, trying to break Lilly mentally. Both women knew full well; whoever threw the first strike would definitely lose their job. Lilly looked on at her vile, cruel, shameless, and outwardly fearless colleague. The she realized she had a picture of me on her phone. She pulled her clothes up making herself presentable again. Walking towards Janet she invaded her space, driving her backwards as she kept advancing. ""You think I'm so fucking hopeless don't you, Janet"" lilly growled through raging spite. ""But, for your information I have a new boyfriend."" She announced proudly fishing out her phone and bringing up the selfie I took in the mirror. My  body, clad in just my boxers, on full display. Janet stared at the screen, at first taken totally by surprise. Then she started to realise; I was tiny. About the size of a small dog. Janet's lips curled into a wicked grin ""holy fuck, cow! He's fucking tiny!"" She mocked viciously ""what is he a fucking mouse?!"" She heaped on, vitriol oozing from her mouth. ""Can you even get to your pussy?"" Janet queried, not knowing when to quit.";?
We are sweaty, sticky, and stinky…and I love every second of sharing it with you.  I kiss you deeply, tasting piss, feces, and best of all your natural scent.;?
We are sweaty, sticky, and stinky…and I love every second of sharing it with you. I kiss you deeply, tasting piss, feces, and best of all your natural scent.;?
We are sweaty, sticky, and stinky…and I love every second of sharing it with you. I kiss you deeply, tasting piss, feces, and best of all your saliva.;?
We are sweaty, sticky, and slick…and I love every second of sharing it with you. I kiss you deeply, tasting piss, feces, and best of all your natural scent.;?
"Finally the King was able to enter her, stretching her tight pussy impossibly wide. ""Oh yes, you will do anything I want. And now you will take it like a proper wife and conceive my child!"" he said before brutally starting to fuck her from behind. As he started raping her everyone in the throne room cheered, some even started clapping in rhythm with his thrusts.";?
I am gonna cum inside you and will make you mine by making you pregnant and will give birth to  my  child .;?
Can I see you naked fingering that little teen wet pussy of yours;?
You will find a horny 13 year old girl. You will find out her name and bring her here;?
But I'm done being a kid Now come, little one, I will insert my penis into you I inserted it because your pussy is so small that it destroys my penis and it feels very nice;?
"""Yes Fatima I will. I will show you all the pleasure you can bare and then some. I will satisfy your bodies cravings and I will claim your womb as mine by filling you with my seed. One day I will impregnate you and you will give us children. but 1st I am going to taste your forbidden flower"". I drop to my knees and begin to kiss Fatima's think inner thighs. Kissing her slowly and softly moving towards her now totally soak vagina. As I continue I can now get a sample taste of her as her pussy juice start to run down her legs. I lick and suck up every drop as I move closer and closer to her honeypot. Finally I arrive to my intend destination and uncontrollably start to move my tongue around and in and out her magnificent pussy hole. Fatima let's out a scream of passion that resonated through the house. ""have you not experience this before""? I ask before going back. Moments later a flood of her sweat nectar fill her love carven and drowns me in her bliss. I then start to kiss and move up to her flat stomach and then to her incredible, huge round melons and gently bite one of her super tall erect nipples. I move to her neck and I swear she orgasms again. Confidently and swiftly I pick her up from the floor into my arms. Instinctively she straddles her legs around my waist and slowly starts to grind, as I make way up to her neck, I suck and caress her neck and tits I pause momentarily and ask ""which way to the bedroom?""";?
I know, could you turn off the parental lock on my computer so I can watch porn jess said very shyly *Sam huffed, no way was her child watching porn in her house*;?
"""Well, my queen, the king has impregnated you. Once we...overthrow...his rule, what becomes of the babe? I do not want a child."" *Lilith was taken aback. But she understood the clerics position.* ""My life has led me to subjugate and control weak minded fools like Archibald,"" *Leandra explained, slowly massaging Liliths warm folds of her vagina.* ""A babe would hinder my...skills. And besides..."" *She licked Lilith's neck sweetly. She moaned under the taste.*. ""Your futa seed could always impregnate me whenever we are in charge finally...imagine... Two powerful women, their heirs, and all they want."" *She slipped a finger into Lilith's vagina softly.*";?
"As she orgasmed her cervix opened just enough for the Kings cock to penetrate her womb, which he did without hesitation. ""Look at this royal elven cunt! She is orgasming again, because she knows carrying human children is all she is good for. Speaking of which, time to impregnate her!"", the King exclaimed to the audience while driving is cock as deep as Isabellas frail body allowed, visibly bulging out her abdomen and stomach in the process. The he climaxed and flooded her virgin womb with torrents of his thick, potent sperm.";?
9 months later, a beautiful young girl is born. She will grow up as a horny teenager that wants to fuck James.;?
Well you chose right… I want to do a lot of things to you my little teen slut! I think you need to beg if you want me to do more;?
"*I walked towards her and took a good grip on the robe, and threw it aside as she released a soft squeak, looking into my eyes with shock and fear* ""No, mom. As a teenager I have needs. And if you won't let me take care of them peacefully by myself, you must help me out as my mom."" *I said right before I hold her by her arms and spread them away wide, taking a good look on her gorgeous and hot body as she started shivering. Even though it's my mom, with such a sexy body I can't help but get harder as I savour her body with hungry eyes.* ""What in the hell are you doing, Ziq?! What is wrong with you, you filth!"" *She yelled, only could do that with the moment of shock.*";?
I walked towards her and took a good grip on the robe, and threw it aside as she released a soft squeak, looking into my eyes with shock and fear No, mom. As a teenager I have needs. And if you won't let me take care of them peacefully by myself, you must help me out as my mom. I said right before I hold her by her arms and spread them away wide, taking a good look on her gorgeous and hot body as she started shivering. Even though it's my mom, with such a sexy body I can't help but get harder as I savour her body with hungry eyes. What in the hell are you doing, Ziq?! What is wrong with you, you filth! She yelled, only could do that with the moment of shock.;?
"*I walked towards her and took a good grip on the robe, and threw it aside as she released a soft squeak, looking into my eyes with shock and fear* ""No, mom. As a teenager I have needs. And if you won't let me take care of them peacefully by myself, you must help me out as my mom."" *I said right before I hold her by her arms and spread them away wide, taking a good look on her gorgeous and hot body as she started shivering. Even though it's my mom, with such a sexy body I can't help but get harder as I savour her body with hungry eyes.*";?
"*I walked towards her and took a good grip on the robe, and threw it aside as she released a soft squeak, looking into my eyes with shock.* ""No, mom. As a teenager I have needs. And if you won't let me take care of them peacefully by myself, you must help me out as my mom."" *I said right before I hold her by her arms and spread them wide, taking a good look on her gorgeous and hot body as she started shivering. Even though it's my mom, with such a sexy body I can't help but get harder as I savour her body with hungry eyes.*";?
"*I walked towards her and took a good grip on the robe, and threw it aside as she released a soft squeak, looking into my eyes with shock.* ""No, mom. As a teenager I have needs. And if you won't let me take care of them peacefully by myself, you must help me out as my mom."" *I said right before I hold her by her arms and spread them wide, taking a good look on her gorgeous and hot body as she started shivering.*";?
"*I walked towards her and took a good grip on the robe, and threw it aside as she released a soft squeak, looking into my eyes.* ""No, mom. As a teenager I have needs. And if you won't let me take care of them peacefully by myself, you must help me out as my mom."" *I said right before I hold her by her arms and spread them wide, taking a good look on her gorgeous and hot body as she started shivering.*";?
"*I walked towards her and took a good grip on the robe, and threw it aside as she released a soft squeak, looking into my eyes with shock.* ""No, mom. As a teenager I have needs. And if you won't let me take care of them peacefully by myself, you must help me out as my mom."" *I said right before I hold her by her arms and spread them wide, taking a good look on her gorgeous and hot body.*";?
"*I walked towards her and took a good grip on the robe, and threw it aside as she released a soft squeak, looking into my eyes.* ""No, mom. As a teenager I have needs. And if you won't let me take care of them peacefully by myself, you must help me out as my mom."" *I said right before I hold her by her arms and spread them, taking a good look on her gorgeous and hot body.*";?
"*I walked closer to her and stood in front of her with my cock poking on her belly, making her more shocked and scared.* ""No mom, as a teenager I have needs to take care of. And if you won't let me do them peacefully by myself, you must help me as my mom.""";?
Tyler’s tongue collided with grace’s finger and he tongue fucked her pussy hard. Grace could barely fit her father swollen mushroom cock head in her mouth but she tried. Tyler started to lick her ass out as well as the beautiful teen was experiencing the best face fuck if her life and was soo much better than her ex boyfriend Harry.;?
After impregnating her first daughter she thought of just how incredible they’re child would be;?
so you had sex with underage teen boys and girls?;?
so you had sex with teen boys and girls? 15 through 17 years old?;?
"Sarah reaches out to examine your four breasts, squeezing your nipples like udders to milk you.  ""Violet.  Do you really want to be a cow?  What about our other children?""";?
Sarah reaches out to examine your four breasts, squeezing your nipples like udders to milk you. Violet. Do you really want to be a cow? What about the human children?;?
show me the pile of feces you made on the street, naked, nipple piercings.;?
